{
  "canonicalHash": "sha256:55a1ac92352bd018460f115cb5061c76140f1eed453afc8a229ed3fa84145718",
  "description": "Canonical production-equivalent default profile.",
  "engineVersion": "1",
  "modelVersion": "phase-2-typed-model-v1",
  "parameters": {
    "evaluation.bishop.badHeavyPenalty": 100,
    "evaluation.bishop.badLightPenalty": 60,
    "evaluation.bishopPair.eg": 80,
    "evaluation.bishopPair.mg": 70,
    "evaluation.endgame.latePhaseMax": 8,
    "evaluation.endgame.mopUpEgMargin": 220,
    "evaluation.endgame.mopUpMaterialMargin": 350,
    "evaluation.endgame.mopUpWeights": [
      15,
      10,
      20,
      7,
      10,
      25,
      12
    ],
    "evaluation.endgame.scaleMinorOnlyClearEdge": 80,
    "evaluation.endgame.scaleMinorOnlyNearEqual": 64,
    "evaluation.endgame.scaleOppositeBishopsLowPawns": 72,
    "evaluation.endgame.scaleOppositeBishopsMinPawns": 56,
    "evaluation.king.attackPressure": [
      0,
      40,
      165,
      400,
      400,
      400,
      160,
      200,
      240
    ],
    "evaluation.king.shieldMaxPawns": 3,
    "evaluation.king.shieldPerPawnBonus": 27,
    "evaluation.king.uncastledCenterPenalty": 50,
    "evaluation.king.uncastledLostRightsPenalty": 66,
    "evaluation.material.eg": [
      160,
      200,
      269,
      650,
      1150,
      0
    ],
    "evaluation.material.mg": [
      150,
      250,
      284,
      490,
      839,
      0
    ],
    "evaluation.mobility.eg": [
      0,
      10,
      10,
      8,
      8,
      0
    ],
    "evaluation.mobility.mg": [
      0,
      3,
      10,
      8,
      5,
      0
    ],
    "evaluation.pawns.backwardByRank.eg": [
      0,
      0,
      30,
      30,
      30,
      0,
      0,
      0,
      0
    ],
    "evaluation.pawns.backwardByRank.mg": [
      0,
      0,
      40,
      20,
      10,
      40,
      0,
      0,
      0
    ],
    "evaluation.pawns.candidateByRank.eg": [
      0,
      0,
      0,
      50,
      50,
      50,
      50,
      0,
      0
    ],
    "evaluation.pawns.candidateByRank.mg": [
      0,
      0,
      0,
      40,
      40,
      40,
      40,
      0,
      0
    ],
    "evaluation.pawns.connectedByRank.eg": [
      0,
      0,
      0,
      0,
      80,
      80,
      80,
      80,
      0
    ],
    "evaluation.pawns.connectedByRank.mg": [
      0,
      0,
      0,
      21,
      60,
      60,
      60,
      0,
      0
    ],
    "evaluation.pawns.doubledPenalty": 30,
    "evaluation.pawns.islandPenalty.eg": 20,
    "evaluation.pawns.islandPenalty.mg": 20,
    "evaluation.pawns.isolatedPenalty": 30,
    "evaluation.pawns.passedBlockedDivisor": 2,
    "evaluation.pawns.passedCountBonus.eg": 6,
    "evaluation.pawns.passedCountBonus.mg": 0,
    "evaluation.pawns.passedEgMultiplier": 4,
    "evaluation.pawns.passedRankSquareMultiplier": 5,
    "evaluation.phase.increments": [
      0,
      1,
      1,
      2,
      4,
      0
    ],
    "evaluation.pst.egPesto": [
      [
        0,
        0,
        0,
        0,
        0,
        0,
        0,
        0,
        178,
        173,
        158,
        134,
        147,
        132,
        165,
        187,
        94,
        100,
        85,
        67,
        56,
        53,
        82,
        84,
        32,
        24,
        13,
        5,
        -2,
        4,
        17,
        17,
        13,
        9,
        -3,
        -7,
        -7,
        -8,
        3,
        -1,
        4,
        7,
        -6,
        1,
        0,
        -5,
        -1,
        -8,
        13,
        8,
        8,
        10,
        13,
        0,
        2,
        -7,
        0,
        0,
        0,
        0,
        0,
        0,
        0,
        0
      ],
      [
        -58,
        -38,
        -13,
        -28,
        -31,
        -27,
        -63,
        -99,
        -25,
        -8,
        -25,
        -2,
        -9,
        -25,
        -24,
        -52,
        -24,
        -20,
        10,
        9,
        -1,
        -9,
        -19,
        -41,
        -17,
        3,
        22,
        22,
        22,
        11,
        8,
        -18,
        -18,
        -6,
        16,
        25,
        16,
        17,
        4,
        -18,
        -23,
        -3,
        -1,
        15,
        10,
        -3,
        -20,
        -22,
        -42,
        -20,
        -10,
        -5,
        -2,
        -20,
        -23,
        -44,
        -29,
        -51,
        -23,
        -15,
        -22,
        -18,
        -50,
        -64
      ],
      [
        -14,
        -21,
        -11,
        -8,
        -7,
        -9,
        -17,
        -24,
        -8,
        -4,
        7,
        -12,
        -3,
        -13,
        -4,
        -14,
        2,
        -8,
        0,
        -1,
        -2,
        6,
        0,
        4,
        -3,
        9,
        12,
        9,
        14,
        10,
        3,
        2,
        -6,
        3,
        13,
        19,
        7,
        10,
        -3,
        -9,
        -12,
        -3,
        8,
        10,
        13,
        3,
        -7,
        -15,
        -14,
        -18,
        -7,
        -1,
        4,
        -9,
        -15,
        -27,
        -23,
        -9,
        -23,
        -5,
        -9,
        -16,
        -5,
        -17
      ],
      [
        13,
        10,
        18,
        15,
        12,
        12,
        8,
        5,
        11,
        13,
        13,
        11,
        -3,
        3,
        8,
        3,
        7,
        7,
        7,
        5,
        4,
        -3,
        -5,
        -3,
        4,
        3,
        13,
        1,
        2,
        1,
        -1,
        2,
        3,
        5,
        8,
        4,
        -5,
        -6,
        -8,
        -11,
        -4,
        0,
        -5,
        -1,
        -7,
        -12,
        -8,
        -16,
        -6,
        -6,
        0,
        2,
        -9,
        -9,
        -11,
        -3,
        -9,
        2,
        3,
        -1,
        -5,
        -13,
        4,
        -20
      ],
      [
        -9,
        22,
        22,
        27,
        27,
        19,
        10,
        20,
        -17,
        20,
        32,
        41,
        58,
        25,
        30,
        0,
        -20,
        6,
        9,
        49,
        47,
        35,
        19,
        9,
        3,
        22,
        24,
        45,
        57,
        40,
        57,
        36,
        -18,
        28,
        19,
        47,
        31,
        34,
        39,
        23,
        -16,
        -27,
        15,
        6,
        9,
        17,
        10,
        5,
        -22,
        -23,
        -30,
        -16,
        -16,
        -23,
        -36,
        -32,
        -33,
        -28,
        -22,
        -43,
        -5,
        -32,
        -20,
        -41
      ],
      [
        -74,
        -35,
        -18,
        -18,
        -11,
        15,
        4,
        -17,
        -12,
        17,
        14,
        17,
        17,
        38,
        23,
        11,
        10,
        17,
        23,
        15,
        20,
        45,
        44,
        13,
        -8,
        22,
        24,
        27,
        26,
        33,
        26,
        3,
        -18,
        -4,
        21,
        24,
        27,
        23,
        9,
        -11,
        -19,
        -3,
        11,
        21,
        23,
        16,
        7,
        -9,
        -27,
        -11,
        4,
        13,
        14,
        4,
        -5,
        -17,
        -53,
        -34,
        -21,
        -11,
        -28,
        -14,
        -24,
        -43
      ]
    ],
    "evaluation.pst.mgPesto": [
      [
        0,
        0,
        0,
        0,
        0,
        0,
        0,
        0,
        98,
        134,
        61,
        95,
        68,
        126,
        34,
        -11,
        -6,
        7,
        26,
        31,
        65,
        56,
        25,
        -20,
        -14,
        13,
        6,
        21,
        23,
        12,
        17,
        -23,
        -27,
        -2,
        -5,
        12,
        17,
        6,
        10,
        -25,
        -26,
        -4,
        -4,
        -10,
        3,
        3,
        33,
        -12,
        -35,
        -1,
        -20,
        -23,
        -15,
        24,
        38,
        -22,
        0,
        0,
        0,
        0,
        0,
        0,
        0,
        0
      ],
      [
        -167,
        -89,
        -34,
        -49,
        61,
        -97,
        -15,
        -107,
        -73,
        -41,
        72,
        36,
        23,
        62,
        7,
        -17,
        -47,
        60,
        37,
        65,
        84,
        129,
        73,
        44,
        -9,
        17,
        19,
        53,
        37,
        69,
        18,
        22,
        -13,
        4,
        16,
        13,
        28,
        19,
        21,
        -8,
        -23,
        -9,
        12,
        10,
        19,
        17,
        25,
        -16,
        -29,
        -53,
        -12,
        -3,
        -1,
        18,
        -14,
        -19,
        -105,
        -21,
        -58,
        -33,
        -17,
        -28,
        -19,
        -23
      ],
      [
        -29,
        4,
        -82,
        -37,
        -25,
        -42,
        7,
        -8,
        -26,
        16,
        -18,
        -13,
        30,
        59,
        18,
        -47,
        -16,
        37,
        43,
        40,
        35,
        50,
        37,
        -2,
        -4,
        5,
        19,
        50,
        37,
        37,
        7,
        -2,
        -6,
        13,
        13,
        26,
        34,
        12,
        10,
        4,
        0,
        15,
        15,
        15,
        14,
        27,
        18,
        10,
        4,
        15,
        16,
        0,
        7,
        21,